name,category,run_url,runtime_sec,last_interval_step_time_sec,last_interval_samples_per_sec,last_interval_mfu,result,notes
baseline,baseline,https://wandb.ai/maxence-frenette/chess-engine-4/runs/y9isv692,26.920450447,0.12628758659999945,32433.908274560516,0.00585501388587806,reference,original code with --max-steps equivalent compute budget
baseline_repeat,baseline,https://wandb.ai/maxence-frenette/chess-engine-4/runs/1c1knweh,26.549803528,0.1232724104000006,33227.22405369612,0.0059982243452345214,reference,original logging and pinned memory with --max-steps
bf16_plane_transfer,failed,https://wandb.ai/maxence-frenette/chess-engine-4/runs/jbwlcqox,66.208320153,0.30432069999999956,13459.485338986162,0.002429724869708258,reverted,CPU dtype conversion dominated any transfer savings
metrics_no_grad,failed,https://wandb.ai/maxence-frenette/chess-engine-4/runs/9bqjs4ct,29.828608155,0.13946900620000022,29368.532203680345,0.0053016479668371195,reverted,no_grad wrapper around metrics was slower
workers_1,failed,https://wandb.ai/maxence-frenette/chess-engine-4/runs/m5lo1y00,64.322728906,0.3092378397999994,13245.468286316776,0.0023910902159814734,reverted,DataLoader subprocess overhead dominated
workers_2,failed,https://wandb.ai/maxence-frenette/chess-engine-4/runs/yzlg79bm,46.028673571,0.2062850458,19856.020023725832,0.0035844361392726068,reverted,still much slower than single-process loading
workers_4,failed,https://wandb.ai/maxence-frenette/chess-engine-4/runs/870241qx,45.988896675,0.20203242329999965,20273.97351918021,0.003659885681116938,reverted,still much slower than single-process loading
torch_compile_full,failed,,0,0,0,0,reverted,failed to trace grouped_mm under Dynamo/autocast
no_grad_norm,failed,https://wandb.ai/maxence-frenette/chess-engine-4/runs/4ya7kphn,27.50555844,0.13117744499999945,31224.880161372388,0.0056367584622267035,reverted,removing grad norm alone was slower
lean_logging,neutral,https://wandb.ai/maxence-frenette/chess-engine-4/runs/72l2h5mv,26.907408643,0.12473917729999968,32836.51607024035,0.005927693200819488,reverted,roughly neutral alone
no_pin_lean,success,https://wandb.ai/maxence-frenette/chess-engine-4/runs/xs31m8ws,23.987215515,0.13395203190000018,30578.110252614948,0.005520002665648433,kept,fastest first combined run
no_pin_lean_repeat,success,https://wandb.ai/maxence-frenette/chess-engine-4/runs/u19hpaju,25.265507678,0.11298624139999944,36252.201588856646,0.006544297464850693,kept,repeat of combined run
no_pin_lean_repeat_2,success,https://wandb.ai/maxence-frenette/chess-engine-4/runs/h4cwtho3,23.78347526,0.10836814330000023,37797.08570498311,0.006823182077689276,kept,mislabeled as baseline-repeat but used optimized code
no_pin_full_logging,failed,https://wandb.ai/maxence-frenette/chess-engine-4/runs/lb4fl7x5,61.214195411,0.2712634928,15099.709724006032,0.002725820439472807,reverted,no pinning without lean logging was much slower
no_pin_lean_no_sync,failed,https://wandb.ai/maxence-frenette/chess-engine-4/runs/wd7dn0mu,29.528956195,0.15221770109999966,26908.828410889782,0.004857618843364771,reverted,removing explicit sync made timing and runtime worse
compile_loss,failed,https://wandb.ai/maxence-frenette/chess-engine-4/runs/8krvyty6,34.291228176,0.1286756453999999,31831.975563574702,0.005746352162124267,reverted,compile overhead exceeded any loss-kernel benefit
deque_loader,failed,https://wandb.ai/maxence-frenette/chess-engine-4/runs/n87mxy5k,24.582435984,0.12087401890000038,33886.52116703954,0.006117241570074266,reverted,small loader queue improvement on top of combined change
compile_dense_parts,failed,https://wandb.ai/maxence-frenette/chess-engine-4/runs/wlrtf7lz,36.17446494,0.1430406982000001,28635.206983350683,0.005169267085953195,reverted,compiling only dense submodules was still slower
streaming_tar,failed,https://wandb.ai/maxence-frenette/chess-engine-4/runs/jniegwgd,23.061984766,0.11132220840000004,36794.095795174675,0.006642120954878799,reverted,sequential tar stream mode
streaming_tar_repeat,failed,https://wandb.ai/maxence-frenette/chess-engine-4/runs/vf1uwsd5,25.579150984,0.11724807780000006,34934.47463579653,0.00630641957660328,reverted,repeat showed the win is noisy but still in optimized band
direct_chunk_fill,failed,https://wandb.ai/maxence-frenette/chess-engine-4/runs/valz791g,24.19688362,0.1150209056999998,35610.91764207876,0.006428532001700506,reverted,avoids concatenating structured records before tensor conversion
cpu2_workers0,failed,https://wandb.ai/maxence-frenette/chess-engine-4/runs/5tixr1hv,41.461897987,0.2048095071000006,19999.07161536247,0.0036102600100296938,reverted,cpu=2 without workers was slower
cpu2_workers1,failed,https://wandb.ai/maxence-frenette/chess-engine-4/runs/sbjluy1y,79.864599762,0.4236838947999999,9667.584843963725,0.001745205758897364,reverted,cpu=2 with one worker was much slower
cpu2_workers2,failed,https://wandb.ai/maxence-frenette/chess-engine-4/runs/kb7tbj1i,54.892435484,0.25483968989999967,16072.84956910476,0.002901492987403866,reverted,cpu=2 with two workers was much slower
router_bincount,failed,https://wandb.ai/maxence-frenette/chess-engine-4/runs/oajal9j8,39.06997065,0.19211323059999968,21320.759570840335,0.0038488529439003978,reverted,bincount router accounting was slower than one_hot
compile_skip_experts,success,https://wandb.ai/maxence-frenette/chess-engine-4/runs/mzlpejeq,33.086107053,0.10209732239999952,40118.58395220774,0.007242262145329565,kept,best steady-state step time despite compile warmup overhead in the 200-step runtime
final_kept,success,https://wandb.ai/maxence-frenette/chess-engine-4/runs/chqealpd,22.874865667,0.10468898880000026,39125.41373214591,0.0070629736864649415,kept,final clean run with retained code changes
compile_grouped_mm_max_autotune_bf16,failed,https://wandb.ai/maxence-frenette/chess-engine-4/runs/u51ipwe2,99.818773659,0.1254571810999991,32648.58945567389,0.00589376842898816,reverted,full grouped_mm compile ran after explicit bf16 operands but was slower
compile_grouped_mm_default_bf16,failed,https://wandb.ai/maxence-frenette/chess-engine-4/runs/byqd74dy,37.568860063,0.17395925599999984,23545.74337797814,0.004250510091610334,reverted,default compile with explicit bf16 operands was slower
compile_skip_experts_explicit_bf16,failed,https://wandb.ai/maxence-frenette/chess-engine-4/runs/3g8ite5g,56.088241487,0.17787101170000028,23027.923217237727,0.004157032481516063,reverted,explicit bf16 operand cast made the graph-break compile path slower
full_bf16_params_only_compile_grouped_mm,failed,,0,0,0,0,reverted,bf16 parameters alone still failed because compiled grouped_mm saw fp32 activations under autocast
full_bf16_inputs_no_autocast_compile_grouped_mm,failed,,0,0,0,0,reverted,compiled forward reached backward but failed on float32 target/loss dtype mismatch
full_bf16_all_tensors_compile_grouped_mm,success,https://wandb.ai/maxence-frenette/chess-engine-4/runs/jktr35bf,65.738091581,0.12078872080000023,33910.45101621766,0.006121561419475049,reverted,full bf16 training with grouped_mm inside compile works but is slower than graph-break compile
threaded_cuda_prefetch,success,https://wandb.ai/maxence-frenette/chess-engine-4/runs/cehts0x3,31.008807695,0.08903293099999984,46005.44937692781,0.008304967216647354,reverted,pinned background cuda prefetch was fast once but not stable across repeats
threaded_cuda_prefetch_repeat,failed,https://wandb.ai/maxence-frenette/chess-engine-4/runs/3r65r47b,59.324578961,0.267015738100001,15339.919770818877,0.0027691834886530314,reverted,pinned background cuda prefetch repeat was much slower
cpu2_threaded_cuda_prefetch,failed,https://wandb.ai/maxence-frenette/chess-engine-4/runs/30z68ooz,48.176871126,0.14265028100000024,28713.57820879437,0.005183414767735533,reverted,cpu=2 did not fix pinned background cuda prefetch
threaded_prefetch_no_pin,success,https://wandb.ai/maxence-frenette/chess-engine-4/runs/dy03ikux,29.853346371,0.08252780949999945,49631.75473595997,0.008959592864960626,reverted,background cuda transfer without pinning was fast once but unstable
threaded_prefetch_no_pin_repeat,failed,https://wandb.ai/maxence-frenette/chess-engine-4/runs/fbn3fd9z,49.267298502,0.16335140449999982,25074.776752225625,0.004526533306648279,reverted,background cuda transfer without pinning repeat was slower
cpu2_threaded_prefetch_no_pin,failed,https://wandb.ai/maxence-frenette/chess-engine-4/runs/gencqe35,45.721273541,0.1562765436999996,26209.94746251232,0.004731455889992445,reverted,cpu=2 with no-pin background transfer was slower
threaded_cpu_prefetch,failed,https://wandb.ai/maxence-frenette/chess-engine-4/runs/q063de8a,31.51088274,0.09399531099999976,43576.64181780313,0.007866515523918281,reverted,custom background thread was fast but not kept because it bypassed PyTorch DataLoader prefetch APIs
threaded_cpu_prefetch_repeat,failed,https://wandb.ai/maxence-frenette/chess-engine-4/runs/42epixxs,28.427554316,0.07671141579999982,53394.92117677757,0.009638924864648716,reverted,custom background thread was fast but not kept because it bypassed PyTorch DataLoader prefetch APIs
pytorch_prefetch_workers1,failed,https://wandb.ai/maxence-frenette/chess-engine-4/runs/eb2u106w,77.515019831,0.3104338872999989,13194.43581248488,0.00238187776337209,reverted,PyTorch DataLoader prefetch with one worker was slower
pytorch_prefetch_workers2,failed,https://wandb.ai/maxence-frenette/chess-engine-4/runs/33i4lspy,103.283387446,0.3641739884000003,11247.371120589338,0.0020303909579200033,reverted,PyTorch DataLoader prefetch with two workers was slower
pytorch_pin_workers0,success,https://wandb.ai/maxence-frenette/chess-engine-4/runs/z55cuaj1,35.396050434,0.1151854612000001,35560.04340589467,0.006419348114369699,kept,PyTorch pin_memory with zero workers was slower
pytorch_pin_workers1,failed,https://wandb.ai/maxence-frenette/chess-engine-4/runs/u5aceskh,129.531569238,0.5349378559000002,7656.964177845913,0.0013822457412609236,reverted,PyTorch pin_memory with one worker was much slower
cleaned_retained_current,failed,https://wandb.ai/maxence-frenette/chess-engine-4/runs/ro1px36q,36.402632725,0.11716468190000028,34959.34042219245,0.006310908382682367,reverted,no-pin current-code benchmark after restoring diagnostics; no longer kept because pinning difference was not significant
